<?xml version="1.0" encoding="UTF-8" ?>
<xs:schema xmlns:xs="http://www.w3.org/2001/XMLSchema">
    <xs:import namespace="http://www.w3.org/XML/1998/namespace"
               schemaLocation="https://www.w3.org/2009/01/xml.xsd" />
    <xs:element name="resourcePool">
        <xs:complexType>
            <xs:sequence>
                <xs:element name="resource" maxOccurs="unbounded">
                    <xs:complexType>
                        <xs:sequence>
                            <!--Personal Background-->
                            <xs:element name="photo" minOccurs="0" maxOccurs="unbounded">
                                <xs:complexType>
                                    <xs:sequence>
                                        <xs:element name="URI" type="xs:anyURI"/>
                                    </xs:sequence>
                                </xs:complexType>
                            </xs:element>
                            <xs:element name="age" type="xs:duration"/>
                            <xs:element name="prefix" type="xs:string" minOccurs="0"/>
                            <xs:element name="firstName" type="xs:string" maxOccurs="unbounded"/>
                            <xs:element name="lastName" type="xs:string" maxOccurs="unbounded"/>
                            <xs:element name="maritalStatus">
                                <xs:complexType>
                                    <xs:simpleContent>
                                        <xs:extension base="xs:string">
                                            <xs:attribute ref="xml:lang" use="required"/>
                                        </xs:extension>
                                    </xs:simpleContent>
                                </xs:complexType>
                            </xs:element>
                            <xs:element name="child" minOccurs="0" maxOccurs="unbounded">
                                <xs:complexType>
                                    <xs:sequence>
                                        <xs:element name="age" type="xs:duration"/>
                                    </xs:sequence>
                                </xs:complexType>
                            </xs:element>
                            <xs:element name="stressor" minOccurs="0" maxOccurs="unbounded">
                                <xs:complexType>
                                    <xs:simpleContent>
                                        <xs:extension base="xs:string">
                                            <xs:attribute ref="xml:lang" use="required"/>
                                        </xs:extension>
                                    </xs:simpleContent>
                                </xs:complexType>
                            </xs:element>
                            <xs:element name="personalInfo" minOccurs="0" maxOccurs="unbounded">
                                <xs:complexType>
                                    <xs:simpleContent>
                                        <xs:extension base="xs:string">
                                            <xs:attribute ref="xml:lang" use="required"/>
                                        </xs:extension>
                                    </xs:simpleContent>
                                </xs:complexType>
                            </xs:element>
                            <!--Professional Background-->
                            <xs:element name="profession" maxOccurs="unbounded">
                                <xs:complexType>
                                    <xs:simpleContent>
                                        <xs:extension base="xs:string">
                                            <xs:attribute ref="xml:lang" use="required"/>
                                        </xs:extension>
                                    </xs:simpleContent>
                                </xs:complexType>
                            </xs:element>
                            <xs:element name="department" maxOccurs="unbounded">
                                <xs:complexType>
                                    <xs:simpleContent>
                                        <xs:extension base="xs:string">
                                            <xs:attribute ref="xml:lang" use="required"/>
                                        </xs:extension>
                                    </xs:simpleContent>
                                </xs:complexType>
                            </xs:element>
                            <xs:element name="workExperience" type="xs:duration" minOccurs="0"/>
                            <xs:element name="trainingDuration" type="xs:duration" minOccurs="0"/>
                            <xs:element name="weeklyHours" type="xs:duration"/>
                            <xs:element name="overtime" type="xs:duration"/>
                            <xs:element name="yearlyTimeOf" type="xs:duration"/>
                            <xs:element name="yearlyEducation" type="xs:duration"/>
                            <xs:element name="training" minOccurs="0" maxOccurs="unbounded">
                                <xs:complexType>
                                    <xs:simpleContent>
                                        <xs:extension base="xs:string">
                                            <xs:attribute ref="xml:lang" use="required"/>
                                        </xs:extension>
                                    </xs:simpleContent>
                                </xs:complexType>
                            </xs:element>
                            <xs:element name="qualification" minOccurs="0" maxOccurs="unbounded">
                                <xs:complexType>
                                    <xs:simpleContent>
                                        <xs:extension base="xs:string">
                                            <xs:attribute ref="xml:lang" use="required"/>
                                        </xs:extension>
                                    </xs:simpleContent>
                                </xs:complexType>
                            </xs:element>
                            <xs:element name="workAgreement" minOccurs="0" maxOccurs="unbounded">
                                <xs:simpleType >
                                    <xs:restriction base="xs:string">
                                        <xs:pattern value="[0-6]-(0[0-9]|1[0-9]|2[0-3]):[0-5][0-9]-(0[0-9]|1[0-9]|2[0-3]):[0-5][0-9]"/>
                                    </xs:restriction>
                                </xs:simpleType>
                            </xs:element>
                            <xs:element name="studies" minOccurs="0" maxOccurs="unbounded">
                                <xs:complexType>
                                    <xs:sequence>
                                        <xs:element name="name" type="xs:string"/>
                                        <xs:element name="location" type="xs:string" minOccurs="0"/>
                                    </xs:sequence>
                                    <xs:attribute ref="xml:lang" use="required"/>
                                </xs:complexType>
                            </xs:element>
                            <xs:element name="additionalJob" minOccurs="0" maxOccurs="unbounded">
                                <xs:complexType>
                                    <xs:sequence>
                                        <xs:element name="name" type="xs:string"/>
                                        <xs:element name="yearlyRequiredDays" type="xs:duration" minOccurs="0"/>
                                    </xs:sequence>
                                    <xs:attribute ref="xml:lang" use="required"/>
                                </xs:complexType>
                            </xs:element>
                            <xs:element name="arrivalTime" type="xs:duration"/>
                            <xs:element name="meansOfTransport" minOccurs="0" maxOccurs="unbounded">
                                <xs:complexType>
                                    <xs:simpleContent>
                                        <xs:extension base="xs:string">
                                            <xs:attribute ref="xml:lang" use="required"/>
                                        </xs:extension>
                                    </xs:simpleContent>
                                </xs:complexType>
                            </xs:element>
                            <xs:element name="professionalInfo" minOccurs="0" maxOccurs="unbounded">
                                <xs:complexType>
                                    <xs:simpleContent>
                                        <xs:extension base="xs:string">
                                            <xs:attribute ref="xml:lang" use="required"/>
                                        </xs:extension>
                                    </xs:simpleContent>
                                </xs:complexType>
                            </xs:element>
                            <!--Skills-->
                            <xs:element name="skill" minOccurs="0" maxOccurs="unbounded">
                                <xs:complexType>
                                    <xs:simpleContent>
                                        <xs:extension base="xs:string">
                                            <xs:attribute ref="xml:lang" use="required"/>
                                        </xs:extension>
                                    </xs:simpleContent>
                                </xs:complexType>
                            </xs:element>
                            <!--Character Traits-->
                            <xs:element name="trait" minOccurs="0" maxOccurs="unbounded">
                                <xs:complexType>
                                    <xs:sequence>
                                        <xs:element name="name" type="xs:string"/>
                                        <xs:element name="value">
                                            <xs:simpleType>
                                                <xs:restriction base="xs:integer">
                                                    <xs:minInclusive value="0"/>
                                                    <xs:maxInclusive value="100"/>
                                                </xs:restriction>
                                            </xs:simpleType>
                                        </xs:element>
                                        
                                    </xs:sequence>
                                    <xs:attribute ref="xml:lang" use="required"/>
                                </xs:complexType>
                            </xs:element>
                        </xs:sequence>
                        <xs:attribute name="id" type="xs:string" use="required"/>
                    </xs:complexType>
                </xs:element>
            </xs:sequence>
        </xs:complexType>
    </xs:element>
</xs:schema>